image_id,image_path,caption_1,caption_2,caption_3,caption_4,caption_5
img_00221,/app/MCC225/Semana7/data/processed/images/imagen_00221.jpg,"A little girl dances in a grassy field , another girl is in the background .",A little girl in a white blouse and blue pants frolics on the grass .,A little girl in blue panes dances on the grass .,"A small girl standing on one leg in the grass , with another child in the background .",There are two small children playing in a yard .
img_00222,/app/MCC225/Semana7/data/processed/images/imagen_00222.jpg,A lady riding a mini motorcycle,an african-american woman rides her moped .,A woman on a motorcycle is wearing heels .,A woman wearing a black skirt and pumps is riding her white and red moped .,Woman riding a small red and white motorcycle and wearing a matching red helmet and scarf
img_00223,/app/MCC225/Semana7/data/processed/images/imagen_00223.jpg,A man and a boy behind the wheel of a car .,A man drives a truck while a child sits on his lap and steers .,A man drives a vehicle with a child on his lap .,Man and little boy driving a large brown SUV .,There is a man with a small boy on his lap sitting in the drivers seat of a jeep .
img_00224,/app/MCC225/Semana7/data/processed/images/imagen_00224.jpg,A man does technical rock climbing .,A man dressed in all black is climbing down a mountain supported by cords,A man is climbing the side of a cliff .,a man wearing a white helmet is abseiling down a sandy colored rock face .,A rock climber with a white helmet is repelling .
img_00225,/app/MCC225/Semana7/data/processed/images/imagen_00225.jpg,A flock of birds disturbed and in flight in front of a wall that has a mural of three women and a man .,A flock of birds flying past a chinese mural on a building .,A flock of birds fly up from the ground next to a building with a mural .,A group of birds fly up from the street against a painted wall .,Flock of pigeons flying in front of building with a mural painted on it .
img_00226,/app/MCC225/Semana7/data/processed/images/imagen_00226.jpg,a bride being escorted under an umbrella to a large black car,a bride takes cover under an umbrella .,A newly wed wife is under an umbrella held by a pastor .,An older newly wed couple stand under an umbrella in the rain .,Newlyweds stand outside in the train .
img_00227,/app/MCC225/Semana7/data/processed/images/imagen_00227.jpg,A boy in a yellow polo standing in tall grass,A kid hides from the camera in the overgrown bushes .,A little boy standing in very tall green grass .,Boy in striped shirt standing among the tall grasses .,"The little boy in a yellow , striped shirt stands in some tall grass ."
img_00228,/app/MCC225/Semana7/data/processed/images/imagen_00228.jpg,A boy carries a boogieboard on the beach .,A boy is carrying a black body board across the sand .,A boy standing on a beach .,A kid in black carrying a cushion .,A young boy wearing a spider-patterned shirt on the sand .
img_00229,/app/MCC225/Semana7/data/processed/images/imagen_00229.jpg,"A person on what appears to be a surfboard , rides the waves onto shore .",A surfer in the distance is at the base of the wave close to the shore .,A surfer is caught in an incoming wave along a dirty beach nearby mountains .,A surfer rides a wave as it crashes on the beach .,A surfer takes on a high wave beyond a rocky beach .
img_00230,/app/MCC225/Semana7/data/processed/images/imagen_00230.jpg,A woman floats with her face out of water in a pool with another woman nearby posing for the camera .,Two children are smiling for picture being taken of them in a swimming pool .,Two children relaxing by the pool .,Two girls in a swimming pool .,Two smiling children in a swimming pool .
img_00231,/app/MCC225/Semana7/data/processed/images/imagen_00231.jpg,A woman in a yellow coat is standing on a sidewalk .,A woman in a yellow jacket and brown hat stands on a path by a lake .,"A woman wearing a brown hat , sunglasses , jeans , white shoes and a yellow trench coat stand on the sidewalk .",A young woman waits under a sculpture in a park .,Woman with hat staring in the distance at park with sculpture .
img_00232,/app/MCC225/Semana7/data/processed/images/imagen_00232.jpg,a lone woman wearing a bikini on a beach walking a dog on a leash,A woman in a bathing suit walks a dog on the beach .,A woman in a bikini pulls a dog on a leash at the beach .,A woman is standing at the beach with her dog on a leash,A woman walking a dog on a beach .
img_00233,/app/MCC225/Semana7/data/processed/images/imagen_00233.jpg,A brown dog playing with a tennis ball on a beach,A dog playing in the waves with a ball .,A dog plays with a ball at the beach .,A small brown dog plays with a ball on the beach .,Brown dog jumping near water on the beach .
img_00234,/app/MCC225/Semana7/data/processed/images/imagen_00234.jpg,A man with a blue shirt posing with a taller man in sunglasses,A man with glasses and a blue and black striped shirt and another man wearing a brown jacket pose for a picture .,One man in stripes and one in leather pose for the camera in a city .,Two men are standing on a street surrounded by buildings .,Two men wearing eyeglasses standing together .
img_00235,/app/MCC225/Semana7/data/processed/images/imagen_00235.jpg,A bunch of people near a christmas type tree .,A couple hurrying past an urban ice skating park .,Many people are outside watching ice skaters .,People are skating in a outdoor rink around a huge Christmas tree .,People walking by an outdoor ice rink with a tree in the center .
img_00236,/app/MCC225/Semana7/data/processed/images/imagen_00236.jpg,A group of young men sit on rock and look in the distance .,Three guys sitting on rocks looking at the scenery .,Three men sit on rocks in the sand while the man in the red hat and shirt looks out .,Three young men sit on rocks at the top of a mountian .,Two guys sit on rocks while another stands looking in the distance .
img_00237,/app/MCC225/Semana7/data/processed/images/imagen_00237.jpg,Two brown dogs are running on the sand .,Two brown dogs on the sand,Two brown dogs running and playing on a beach .,Two brown dogs running together on sand,Two dogs run on the beach .
img_00238,/app/MCC225/Semana7/data/processed/images/imagen_00238.jpg,A young boy poses behind the netting of an enclosed play area while three other children play .,Children playing in a green and blue bounce house .,Children play in the blue and green jumping tent filled with air .,Four children are playing on a bouncy castle .,The little kids all play and jump around inside the inflatable toy .
img_00239,/app/MCC225/Semana7/data/processed/images/imagen_00239.jpg,Two black dogs in the snow .,Two black dogs jump in the snow .,Two black dogs run in the snow in a field of dry grass .,Two dogs are running and playing in the snow,Two dogs playing in the snow .
